{
  "defaultShell": "sh",
  "defaultTimeout": 5400,
  "defaultExitCode": 0,
  "stopOnFailure": false,
  "variables": {
    "RATA": "202601",
    "REMOTE_HOME_ORDINARIA": "/home6/pemco/${RATA}/ordinaria",
    "REMOTE_HOME_SPECIALE1": "/home6/pemco/${RATA}/speciale1",
    "REMOTE_HOME_SPECIALE2": "/home6/pemco/${RATA}/speciale2",
    "REMOTE_HOME_SPECIALE3": "/home6/pemco/${RATA}/speciale3",
    "REMOTE_HOME_RITENUTE": "/home6/pemco/${RATA}/ritenute",
    "SINIIS_CWD": "/home6/pemco/opi/gestione_siniis",
    "SINIIS_PYTHON": "/home6/pemco/opi/.transf_venv/bin/python",
    "SINIIS_REMOTE_DIR_FILES": "/home6/pemco/202601/ritenute/elaborazioni/files/mese",
    "SINIIS_FILE_PATH": "/home6/pemco/202601/ritenute/elaborazioni/files/mese/siniis.txt"
  },
  "steps": [
    {
      "stepNumber": 1,
      "name": "ORDINARIA-202601 - Transfer FILE_UTILITY",
      "run": "python3_launcher_new.sh opi-storage-transfer -r 202601 -t ORDINARIA -s SPT -f FILE_UTILITY",
      "env": {
        "REMOTE_HOME": "/home6/pemco/202601/ordinaria",
        "REMOTE_ROOT": "/"
      },
      "expect": {
        "exitCode": 0,
        "preCheck": {
          "type": "mongodb_files",
          "rata": "202601",
          "remoteHome": "/home6/pemco/202601/ordinaria"
        },
        "postCheck": {
          "type": "mongodb_polling_nonzero",
          "rata": "202601",
          "mongoHost": "${MONGO_HOST}",
          "mongoPort": "${MONGO_PORT}",
          "mongoDb": "${MONGO_DB}",
          "mongoUser": "${MONGO_USER}",
          "mongoPass": "${MONGO_PASS}",
          "mongoUri": "${MONGODB_URI}",
          "pollIntervalSec": 10,
          "stabilityTimeoutMin": 10,
          "maxWaitMin": 10
        }
      },
      "cwd": "/home6/pemco"
    },
    {
      "stepNumber": 2,
      "name": "ORDINARIA-202601 - Transfer FILE_EMISTI",
      "run": "python3_launcher_new.sh opi-storage-transfer -r 202601 -t ORDINARIA -s SPT -f FILE_EMISTI",
      "env": {
        "REMOTE_HOME": "/home6/pemco/202601/ordinaria",
        "REMOTE_ROOT": "/"
      },
      "expect": {
        "exitCode": 0,
        "preCheck": {
          "type": "mongodb_emisti",
          "rata": "202601",
          "remoteHome": "/home6/pemco/202601/ordinaria"
        },
        "postCheck": {
          "type": "mongodb_emisti_quality",
          "rata": "202601",
          "tipoFlusso": "ORDINARIA",
          "mongoHost": "${MONGO_HOST}",
          "mongoPort": "${MONGO_PORT}",
          "mongoDb": "${MONGO_DB}",
          "mongoUser": "${MONGO_USER}",
          "mongoPass": "${MONGO_PASS}",
          "mongoUri": "${MONGODB_URI}",
          "pollIntervalSec": 30,
          "stabilityTimeoutMin": 30,
          "maxWaitMin": 120
        }
      },
      "cwd": "/home6/pemco"
    },
    {
      "stepNumber": 4,
      "name": "SPECIALE1-202601 - Transfer FILE_UTILITY",
      "run": "python3_launcher_new.sh opi-storage-transfer -r 202601 -t SPECIALE -s SPT -f FILE_UTILITY",
      "env": {
        "REMOTE_HOME": "/home6/pemco/202601/speciale1",
        "REMOTE_ROOT": "/"
      },
      "expect": {
        "exitCode": 0,
        "preCheck": {
          "type": "mongodb_files",
          "rata": "202601",
          "remoteHome": "/home6/pemco/202601/speciale1"
        },
        "postCheck": {
          "type": "mongodb_polling_nonzero",
          "rata": "202601",
          "mongoHost": "${MONGO_HOST}",
          "mongoPort": "${MONGO_PORT}",
          "mongoDb": "${MONGO_DB}",
          "mongoUser": "${MONGO_USER}",
          "mongoPass": "${MONGO_PASS}",
          "mongoUri": "${MONGODB_URI}",
          "pollIntervalSec": 10,
          "stabilityTimeoutMin": 10,
          "maxWaitMin": 10
        }
      },
      "cwd": "/home6/pemco"
    },
    {
      "stepNumber": 5,
      "name": "SPECIALE1-202601 - Transfer FILE_EMISTI",
      "run": "python3_launcher_new.sh opi-storage-transfer -r 202601 -t SPECIALE -s SPT -f FILE_EMISTI",
      "env": {
        "REMOTE_HOME": "/home6/pemco/202601/speciale1",
        "REMOTE_ROOT": "/"
      },
      "expect": {
        "exitCode": 0,
        "preCheck": {
          "type": "mongodb_emisti_speciale",
          "rata": "202601",
          "remoteHome": "/home6/pemco/202601/speciale1"
        },
        "postCheck": {
          "type": "mongodb_emisti_quality",
          "rata": "202601",
          "tipoFlusso": "SPECIALE",
          "progressivoSpeciale": 1,
          "mongoHost": "${MONGO_HOST}",
          "mongoPort": "${MONGO_PORT}",
          "mongoDb": "${MONGO_DB}",
          "mongoUser": "${MONGO_USER}",
          "mongoPass": "${MONGO_PASS}",
          "mongoUri": "${MONGODB_URI}",
          "pollIntervalSec": 30,
          "stabilityTimeoutMin": 30,
          "maxWaitMin": 120
        }
      },
      "cwd": "/home6/pemco"
    },
    {
      "stepNumber": 7,
      "name": "SPECIALE2-202601 - Transfer FILE_UTILITY",
      "run": "python3_launcher_new.sh opi-storage-transfer -r 202601 -t SPECIALE -s SPT -f FILE_UTILITY",
      "env": {
        "REMOTE_HOME": "/home6/pemco/202601/speciale2",
        "REMOTE_ROOT": "/"
      },
      "expect": {
        "exitCode": 0,
        "preCheck": {
          "type": "mongodb_files",
          "rata": "202601",
          "remoteHome": "/home6/pemco/202601/speciale2"
        },
        "postCheck": {
          "type": "mongodb_polling_nonzero",
          "rata": "202601",
          "mongoHost": "${MONGO_HOST}",
          "mongoPort": "${MONGO_PORT}",
          "mongoDb": "${MONGO_DB}",
          "mongoUser": "${MONGO_USER}",
          "mongoPass": "${MONGO_PASS}",
          "mongoUri": "${MONGODB_URI}",
          "pollIntervalSec": 10,
          "stabilityTimeoutMin": 10,
          "maxWaitMin": 10
        }
      },
      "cwd": "/home6/pemco"
    },
    {
      "stepNumber": 8,
      "name": "SPECIALE2-202601 - Transfer FILE_EMISTI",
      "run": "python3_launcher_new.sh opi-storage-transfer -r 202601 -t SPECIALE -s SPT -f FILE_EMISTI",
      "env": {
        "REMOTE_HOME": "/home6/pemco/202601/speciale2",
        "REMOTE_ROOT": "/"
      },
      "expect": {
        "exitCode": 0,
        "preCheck": {
          "type": "mongodb_emisti_speciale",
          "rata": "202601",
          "remoteHome": "/home6/pemco/202601/speciale2"
        },
        "postCheck": {
          "type": "mongodb_emisti_quality",
          "rata": "202601",
          "tipoFlusso": "SPECIALE",
          "progressivoSpeciale": 2,
          "mongoHost": "${MONGO_HOST}",
          "mongoPort": "${MONGO_PORT}",
          "mongoDb": "${MONGO_DB}",
          "mongoUser": "${MONGO_USER}",
          "mongoPass": "${MONGO_PASS}",
          "mongoUri": "${MONGODB_URI}",
          "pollIntervalSec": 30,
          "stabilityTimeoutMin": 30,
          "maxWaitMin": 120
        }
      },
      "cwd": "/home6/pemco"
    },
    {
      "stepNumber": 10,
      "name": "SPECIALE3-202601 - Transfer FILE_UTILITY",
      "run": "python3_launcher_new.sh opi-storage-transfer -r 202601 -t SPECIALE -s SPT -f FILE_UTILITY",
      "env": {
        "REMOTE_HOME": "/home6/pemco/202601/speciale3",
        "REMOTE_ROOT": "/"
      },
      "expect": {
        "exitCode": 0,
        "preCheck": {
          "type": "mongodb_files",
          "rata": "202601",
          "remoteHome": "/home6/pemco/202601/speciale3"
        },
        "postCheck": {
          "type": "mongodb_polling_nonzero",
          "rata": "202601",
          "mongoHost": "${MONGO_HOST}",
          "mongoPort": "${MONGO_PORT}",
          "mongoDb": "${MONGO_DB}",
          "mongoUser": "${MONGO_USER}",
          "mongoPass": "${MONGO_PASS}",
          "mongoUri": "${MONGODB_URI}",
          "pollIntervalSec": 10,
          "stabilityTimeoutMin": 10,
          "maxWaitMin": 10
        }
      },
      "cwd": "/home6/pemco"
    },
    {
      "stepNumber": 11,
      "name": "SPECIALE3-202601 - Transfer FILE_EMISTI",
      "run": "python3_launcher_new.sh opi-storage-transfer -r 202601 -t SPECIALE -s SPT -f FILE_EMISTI",
      "env": {
        "REMOTE_HOME": "/home6/pemco/202601/speciale3",
        "REMOTE_ROOT": "/"
      },
      "expect": {
        "exitCode": 0,
        "preCheck": {
          "type": "mongodb_emisti_speciale",
          "rata": "202601",
          "remoteHome": "/home6/pemco/202601/speciale3"
        },
        "postCheck": {
          "type": "mongodb_emisti_quality",
          "rata": "202601",
          "tipoFlusso": "SPECIALE",
          "progressivoSpeciale": 3,
          "mongoHost": "${MONGO_HOST}",
          "mongoPort": "${MONGO_PORT}",
          "mongoDb": "${MONGO_DB}",
          "mongoUser": "${MONGO_USER}",
          "mongoPass": "${MONGO_PASS}",
          "mongoUri": "${MONGODB_URI}",
          "pollIntervalSec": 30,
          "stabilityTimeoutMin": 30,
          "maxWaitMin": 120
        }
      },
      "cwd": "/home6/pemco"
    }
  ]
}
