{
  "defaultShell": "sh",
  "defaultTimeout": 60,
  "defaultExitCode": 0,
  "stopOnFailure": true,
  "steps": [
    {
      "name": "Test Environment",
      "run": "bash test_env.sh",
      "env": {
        "REMOTE_HOME": "/home6/pemco/202503/ordinaria",
        "REMOTE_ROOT": "/"
      },
      "expect": {
        "exitCode": 0
      },
      "cwd": "/home6/pemco"
    }
  ]
}
