{
  "defaultShell": "sh",
  "defaultTimeout": 0,
  "defaultExitCode": 0,
  "stopOnFailure": false,
  "variables": {
    "RATA": "202501"
  },
  "steps": [
    {
      "name": "ORDINARIA - Transfer FILE_UTILITY",
      "run": "echo 'ORDINARIA FILE_UTILITY complete'",
      "expect": {
        "exitCode": 0
      }
    },
    {
      "name": "ORDINARIA - Transfer FILE_EMISTI",
      "run": "echo 'ORDINARIA FILE_EMISTI complete'",
      "expect": {
        "exitCode": 0
      }
    },
    {
      "name": "ORDINARIA - Transfer FILE_22000X",
      "run": "echo 'ORDINARIA FILE_22000X complete'",
      "expect": {
        "exitCode": 0
      }
    },
    {
      "name": "SPECIALE1 - Transfer FILE_UTILITY",
      "run": "echo 'SPECIALE1 FILE_UTILITY complete'",
      "expect": {
        "exitCode": 0
      }
    },
    {
      "name": "SPECIALE1 - Transfer FILE_EMISTI",
      "run": "echo 'SPECIALE1 FILE_EMISTI complete'",
      "expect": {
        "exitCode": 0
      }
    },
    {
      "name": "SPECIALE1 - Transfer FILE_22000X",
      "run": "echo 'SPECIALE1 FILE_22000X complete'",
      "expect": {
        "exitCode": 0
      }
    },
    {
      "name": "RITENUTE - Transfer FILE_UTILITY",
      "run": "echo 'RITENUTE FILE_UTILITY complete'",
      "expect": {
        "exitCode": 0
      }
    },
    {
      "name": "RITENUTE - Transfer ANASTI",
      "run": "echo 'RITENUTE ANASTI complete'",
      "expect": {
        "exitCode": 0
      }
    },
    {
      "name": "RITENUTE - Transfer FILE_22000X",
      "run": "echo 'RITENUTE FILE_22000X complete'",
      "expect": {
        "exitCode": 0
      }
    }
  ]
}
